title,upvote_ratio,subreddit_name_prefixed,date
"the billion dollar question…how bad will it get if queen kamala wins in november? if people are struggling today, what will the next four years look like?",1.0,r/republicans,2024-08-20 21:33:15-04:00
kamala caught faking campaign event!! holy freakin crap...,0.6,r/republicans,2024-08-20 19:38:58-04:00
kamala harris goes full 'kamala•nism!!',0.4,r/republicans,2024-08-20 18:01:53-04:00
"even after dr. anthony fauci admitted he lied 12 times about covid and vaccines, supposedly to keep the public calm, kamala harris still calls him an ""american hero"".  his mistakes, lies, and deceptions cost thousands of lives, school closings, and a $500,000,000 hit to the american economy.",0.55,r/republicans,2024-08-19 16:20:14-04:00
trump to counter harris with competing economic agenda rollout,0.44,r/republicans,2024-08-19 14:24:15-04:00
"dnc trots out obama, clinton to gaslight voters about harris. democrats are a dishonest mess.",0.51,r/republicans,2024-08-19 07:58:41-04:00
"poll: most registered democrats, independents are clueless about kamala harris' radicalism.",0.58,r/republicans,2024-08-18 22:54:07-04:00
trump to counter harris with competing economic agenda rollout,0.4,r/republicans,2024-08-19 14:24:15-04:00
"dnc trots out obama, clinton to gaslight voters about harris. democrats are a dishonest mess.",0.48,r/republicans,2024-08-19 07:58:41-04:00
"poll: most registered democrats, independents are clueless about kamala harris' radicalism.",0.54,r/republicans,2024-08-18 22:54:07-04:00
trump campaign brazenly steals kamala harris’ beyoncé anthem,0.97,r/politics,2024-08-20 17:05:42-04:00
donald trump “disgusts me to my core”: ex-maga supporters tell the world why they’re voting for kamala harris,0.98,r/politics,2024-08-20 16:45:57-04:00
trump melts down after harris’s debate decision leaves him rattled,0.92,r/politics,2024-08-20 09:58:46-04:00
"america’s most popular democrat can’t wait to vote for kamala harris |
jimmy carter was born at the height of jim crow. now, he wants to live long enough to help send a black woman to the white house.",0.98,r/politics,2024-08-20 12:35:11-04:00
rep. crockett at dnc: 'kamala harris has a résumé; donald trump has a rap sheet',0.92,r/politics,2024-08-20 07:31:06-04:00
kamala harris raises $500 million in one month as enthusiasm grows: report,0.98,r/politics,2024-08-20 19:48:26-04:00
harris and walz are hitting trump where it hurts: his masculinity,0.98,r/politics,2024-08-20 09:47:36-04:00
"election polling shows harris’s gains over trump, opening paths to electoral college victory",0.97,r/politics,2024-08-20 21:53:17-04:00
harris energizes democrats in transformed presidential race,0.95,r/politics,2024-08-20 20:45:11-04:00
tim walz's wife gwen discloses she used different fertility treatment than ivf,0.15,r/politics,2024-08-20 21:09:16-04:00
introducing r/whatkamalahasdone - please subscribe today,0.91,r/democrats,2024-08-16 15:28:22-04:00
taylor swift should endorse kamala to get back at trump for his obvious fake ai endorsement. ,0.94,r/democrats,2024-08-20 15:21:49-04:00
🚨breaking: harris never agreed to a debate that never existed on a network that never scheduled it,0.96,r/democrats,2024-08-20 09:10:30-04:00
kamala makes surprise appearance at dnc in tan suit. ,0.89,r/democrats,2024-08-19 22:09:49-04:00
"exclusive: harris' election effort raises around $500 million in a month, sources say",0.98,r/democrats,2024-08-20 16:34:39-04:00
trump’s latest scheme to beat harris may have crossed legal lines,0.98,r/democrats,2024-08-20 17:46:01-04:00
kamala harris' polling lead is growing. it will likely get better,0.98,r/democrats,2024-08-20 09:26:04-04:00
frito-lay should market doritos with a picture of kamala harris on  the bag. ,0.91,r/democrats,2024-08-20 12:03:26-04:00
tim walz’s kids having some fun during his interview on national tv is the most relatable minnesota content!,0.98,r/democrats,2024-08-20 08:06:28-04:00
harris energizes democrats in transformed presidential race,0.56,r/moderatepolitics,2024-08-20 20:37:20-04:00
harris plan to cap prescription drug costs is likely to increase premiums,0.61,r/moderatepolitics,2024-08-20 10:40:37-04:00
"roanoke college poll: harris holds slim lead over trump in virginia
",0.71,r/moderatepolitics,2024-08-20 10:42:35-04:00
harris super pac founder says public polls are too optimistic,0.91,r/moderatepolitics,2024-08-19 18:04:07-04:00
the unpleasant arithmetic of kamala harris’s housing plan ,0.51,r/moderatepolitics,2024-08-20 13:42:55-04:00
how kamala harris sees the economy,0.56,r/moderatepolitics,2024-08-19 13:40:36-04:00
"harris puts four sun belt states back in play, times/siena polls find",0.74,r/moderatepolitics,2024-08-18 10:35:58-04:00
house republicans target tim walz in new probe,0.84,r/moderatepolitics,2024-08-17 15:15:10-04:00
harris now aims to eliminate billions in painful medical debt,0.75,r/moderatepolitics,2024-08-16 18:27:10-04:00
harris to announce 4-year plan to lower housing costs,0.83,r/moderatepolitics,2024-08-16 13:02:11-04:00
harris has proposed a slew of economic policies. here’s a look at what’s in them,0.81,r/moderatepolitics,2024-08-16 16:38:30-04:00
the times demand serious economic ideas. harris supplies gimmicks. | ‘price gouging’ is not causing inflation. so why is the vice president promising to stamp it out?,0.52,r/moderatepolitics,2024-08-17 00:19:26-04:00
"roanoke college poll: harris holds slim lead over trump in virginia
",0.7,r/moderatepolitics,2024-08-20 10:42:35-04:00
the unpleasant arithmetic of kamala harris’s housing plan ,0.52,r/moderatepolitics,2024-08-20 13:42:55-04:00
"what is the reason that democratic senate candidates continue to outperform the presidential ticket, and what can the harris campaign and democrats do to boost her chances close to that of the party's senate candidates in swing states?",0.93,r/PoliticalDiscussion,2024-08-19 17:39:17-04:00
would it help kamala harris' campaign if she added banning investment firms from owning single family homes to her economic agenda?,0.94,r/PoliticalDiscussion,2024-08-17 20:46:17-04:00
"a long-time republican pollster tried doing a focus group with undecided gen z voters for a major news outlet but couldn't recruit enough women for it because they kept saying they're voting for kamala harris. what are your thoughts on this, and what does it say about the state of the race?",0.94,r/PoliticalDiscussion,2024-08-17 16:45:43-04:00
should harris and walz take the time to visit each of the closely contested senate and house seats? how vital are such visits in general?,0.94,r/PoliticalDiscussion,2024-08-17 16:43:32-04:00
"kamala harris has revealed her economic plan, what are your opinions?",0.93,r/PoliticalDiscussion,2024-08-16 17:20:19-04:00
kamala harris rally in milwaukee | aug 20,0.89,r/democrats,2024-08-20 20:50:32-04:00
"even after dr. anthony fauci admitted he lied 12 times about covid and vaccines, supposedly to keep the public calm, kamala harris still calls him an ""american hero"".  his mistakes, lies, and deceptions cost thousands of lives, school closings, and a $500,000,000 hit to the american economy.",0.4,r/republicans,2024-08-19 16:20:14-04:00
"dnc trots out obama, clinton to gaslight voters about harris. democrats are a dishonest mess.",0.52,r/republicans,2024-08-19 07:58:41-04:00
trump to counter harris with competing economic agenda rollout,0.29,r/republicans,2024-08-19 14:24:15-04:00
"poll: most registered democrats, independents are clueless about kamala harris' radicalism.",0.6,r/republicans,2024-08-18 22:54:07-04:00
"can donald trump stop preaching to the choir long enough to follow some good advice and a vet's warning to help him win over some new voters that are still undecided? his lack of self control is getting as bad as biden's memory. seriously, check out these ideas donald before kamala swipes them too! ",0.75,r/republicans,2024-08-18 15:47:27-04:00
harris looks to shift blame for biden-era inflation away from government - washington examiner,0.56,r/republicans,2024-08-18 10:05:38-04:00
won't admit the nothing harris has done ,0.6,r/republicans,2024-08-17 21:17:44-04:00
left-wing wash post slams harris' price controls,0.89,r/republicans,2024-08-17 18:23:09-04:00
kamala harris - inflation,0.62,r/republicans,2024-08-17 19:24:03-04:00
harris' economic plan promises voters affordable groceries and homes. don't fall for it.,0.65,r/republicans,2024-08-17 09:31:07-04:00
"even after dr. anthony fauci admitted he lied 12 times about covid and vaccines, supposedly to keep the public calm, kamala harris still calls him an ""american hero"".  his mistakes, lies, and deceptions cost thousands of lives, school closings, and a $500,000,000 hit to the american economy.",0.36,r/republicans,2024-08-19 16:20:14-04:00
"dnc trots out obama, clinton to gaslight voters about harris. democrats are a dishonest mess.",0.54,r/republicans,2024-08-19 07:58:41-04:00
"poll: most registered democrats, independents are clueless about kamala harris' radicalism.",0.62,r/republicans,2024-08-18 22:54:07-04:00
"can donald trump stop preaching to the choir long enough to follow some good advice and a vet's warning to help him win over some new voters that are still undecided? his lack of self control is getting as bad as biden's memory. seriously, check out these ideas donald before kamala swipes them too! ",0.85,r/republicans,2024-08-18 15:47:27-04:00
harris looks to shift blame for biden-era inflation away from government - washington examiner,0.58,r/republicans,2024-08-18 10:05:38-04:00
kamala harris - inflation,0.64,r/republicans,2024-08-17 19:24:03-04:00
harris' economic plan promises voters affordable groceries and homes. don't fall for it.,0.62,r/republicans,2024-08-17 09:31:07-04:00
"harris proposes raising the corporate tax rate to 28%, rolling back a trump law",0.98,r/politics,2024-08-19 15:29:18-04:00
tim walz doesn’t mention trump or vance as he kicks off dnc,0.97,r/politics,2024-08-19 12:23:44-04:00
kamala harris is redefining how a woman runs for president - she is avoiding the sexist traps that snared hillary clinton.,0.97,r/politics,2024-08-19 10:36:49-04:00
trump in real peril as new polls show kamala has many paths to victory,0.92,r/politics,2024-08-19 05:33:44-04:00
kamala harris leading trump in state he won twice—most accurate pollster ,0.95,r/politics,2024-08-19 12:11:38-04:00
trump is worried about the tv ratings for harris’ dnc speech,0.97,r/politics,2024-08-19 09:13:49-04:00
"conservative republican endorses harris, calls trump a threat to democracy",0.98,r/politics,2024-08-19 12:11:26-04:00
mark hamill tells voters ‘don’t go to the orange side’ at dnc | the star wars actor has endorsed the kamala harris - tim walz ticket for the upcoming election.,0.97,r/politics,2024-08-19 14:36:09-04:00
"harris is sailing, trump is flailing, and the right is bailing. wow.",0.96,r/politics,2024-08-19 09:56:39-04:00
conservative former judge j. michael luttig endorses harris,0.98,r/politics,2024-08-19 13:39:21-04:00
tim walz gave queer high schoolers a refuge. those students are now campaigning for his white house bid,0.98,r/politics,2024-08-19 11:32:13-04:00
'evangelicals for harris' ad denounces trump as false prophet,0.99,r/politics,2024-08-19 17:40:41-04:00
harris proposes raising corporate tax rate to 28 percent,0.97,r/politics,2024-08-19 17:10:56-04:00
walz responds to gop criticism of how harris laughs: 'she has a joy emanating out of her',0.96,r/politics,2024-08-19 17:12:39-04:00
china’s rulers are surprised by kamala harris and tim walz,0.77,r/politics,2024-08-19 18:12:11-04:00
introducing r/whatkamalahasdone - please subscribe today,0.92,r/democrats,2024-08-16 15:28:22-04:00
kamala leads trump 51%-45% in washington post poll on msnbc,0.98,r/democrats,2024-08-19 15:28:33-04:00
"exclusive: conservative republican endorses harris, calls trump a threat to democracy",0.99,r/democrats,2024-08-19 13:30:03-04:00
"if trump manages to stay calm during the debate, kamala should point out that he's ""low energy"".  he'll blow his stack.",0.98,r/democrats,2024-08-19 08:57:58-04:00
"harris proposes raising the corporate tax rate to 28%, rolling back a trump law",0.99,r/democrats,2024-08-19 16:50:06-04:00
climate groups say they’re putting $55m into pro-harris ads,0.97,r/democrats,2024-08-19 12:36:39-04:00
"harris is sailing, trump is
flailing, and the right is bailing. wow.",0.97,r/democrats,2024-08-19 16:29:08-04:00
trump will not stop his smear campaign against kamala harris. ,0.93,r/democrats,2024-08-19 14:12:49-04:00
harris super pac founder says public polls are too optimistic,0.83,r/moderatepolitics,2024-08-19 18:04:07-04:00
how kamala harris sees the economy,0.51,r/moderatepolitics,2024-08-19 13:40:36-04:00
"harris puts four sun belt states back in play, times/siena polls find",0.75,r/moderatepolitics,2024-08-18 10:35:58-04:00
house republicans target tim walz in new probe,0.84,r/moderatepolitics,2024-08-17 15:15:10-04:00
harris now aims to eliminate billions in painful medical debt,0.75,r/moderatepolitics,2024-08-16 18:27:10-04:00
harris to announce 4-year plan to lower housing costs,0.83,r/moderatepolitics,2024-08-16 13:02:11-04:00
harris has proposed a slew of economic policies. here’s a look at what’s in them,0.81,r/moderatepolitics,2024-08-16 16:38:30-04:00
"why dem lawmakers are giving harris a pass on policy proposals
",0.58,r/moderatepolitics,2024-08-16 21:17:19-04:00
the times demand serious economic ideas. harris supplies gimmicks. | ‘price gouging’ is not causing inflation. so why is the vice president promising to stamp it out?,0.52,r/moderatepolitics,2024-08-17 00:19:26-04:00
kamala harris wants to ban grocery price gouging. what economists think of price controls,0.8,r/moderatepolitics,2024-08-16 10:19:14-04:00
diocletian and harris on inflation and price-gouging,0.55,r/moderatepolitics,2024-08-16 19:15:35-04:00
"‘i’m entitled to personal attacks’ against harris, trump asserts at n.j. country club",0.83,r/moderatepolitics,2024-08-15 22:48:33-04:00
how kamala harris sees the economy,0.5,r/moderatepolitics,2024-08-19 13:40:36-04:00
"what is the reason that democratic senate candidates continue to outperform the presidential ticket, and what can the harris campaign and democrats do to boost her chances close to that of the party's senate candidates in swing states?",1.0,r/PoliticalDiscussion,2024-08-19 17:39:17-04:00
would it help kamala harris' campaign if she added banning investment firms from owning single family homes to her economic agenda?,0.94,r/PoliticalDiscussion,2024-08-17 20:46:17-04:00
"a long-time republican pollster tried doing a focus group with undecided gen z voters for a major news outlet but couldn't recruit enough women for it because they kept saying they're voting for kamala harris. what are your thoughts on this, and what does it say about the state of the race?",0.94,r/PoliticalDiscussion,2024-08-17 16:45:43-04:00
should harris and walz take the time to visit each of the closely contested senate and house seats? how vital are such visits in general?,0.94,r/PoliticalDiscussion,2024-08-17 16:43:32-04:00
"kamala harris has revealed her economic plan, what are your opinions?",0.93,r/PoliticalDiscussion,2024-08-16 17:20:19-04:00
what is the harris walz campaign doing right so far? what other things would you recommend they do?,0.86,r/PoliticalDiscussion,2024-08-16 21:31:56-04:00
what could kamala harris do to pursue her economic agenda without the us senate on her side?,0.74,r/PoliticalDiscussion,2024-08-16 14:22:59-04:00
"since biden dropped out, according to the polls almost all the 3rd party/undecided voters have gone to harris instead of splitting evenly. why did this happen?",0.94,r/PoliticalDiscussion,2024-08-15 16:43:22-04:00
"what is the reason that democratic senate candidates continue to outperform the presidential ticket, and what can the harris campaign and democrats do to boost her chances close to that of the party's senate candidates in swing states?",0.96,r/PoliticalDiscussion,2024-08-19 17:39:17-04:00
what could kamala harris do to pursue her economic agenda without the us senate on her side?,0.76,r/PoliticalDiscussion,2024-08-16 14:22:59-04:00
"harris proposes raising the corporate tax rate to 28%, rolling back a trump law",1.0,r/democrats,2024-08-19 16:50:06-04:00
"harris is sailing, trump is
flailing, and the right is bailing. wow.",0.96,r/democrats,2024-08-19 16:29:08-04:00
harris looks to shift blame for biden-era inflation away from government - washington examiner,0.7,r/republicans,2024-08-18 10:05:38-04:00
won't admit the nothing harris has done ,0.57,r/republicans,2024-08-17 21:17:44-04:00
left-wing wash post slams harris' price controls,0.87,r/republicans,2024-08-17 18:23:09-04:00
harris' economic plan promises voters affordable groceries and homes. don't fall for it.,0.58,r/republicans,2024-08-17 09:31:07-04:00
"donald trump rocks kamala harris' campaign with truth bomb - trump responds after white house says no 'daylight' between biden, harris",0.67,r/republicans,2024-08-17 12:13:27-04:00
who do you think europeans want to win? harris or trump?,0.61,r/republicans,2024-08-17 06:16:11-04:00
"a story everyone should know: harris, biden, and gianfranco torres-navarro - washington examiner",0.71,r/republicans,2024-08-17 09:28:54-04:00
communism is alive and well in the democratic party. what happened first: 1) ronald reagan rolled over in his grave or 2) mikhail gorbachev gave queen kamala a dainty salute? please do your research as the msm will push this “as american as east berlin.”,0.46,r/republicans,2024-08-17 10:02:55-04:00
"harris follows vance, pitches increased child tax credit",0.86,r/republicans,2024-08-16 13:59:36-04:00
joe &amp; kamala just got booed into oblivion!! lol,0.58,r/republicans,2024-08-16 17:54:01-04:00
opinion | kamala harris’s price gouging proposal is a terrible idea -…,0.72,r/republicans,2024-08-16 10:48:29-04:00
report: kamala's momentum jolts house republicans,1.0,r/republicans,2024-08-16 14:02:49-04:00
the tim walz situation just got crazy lol,0.6,r/republicans,2024-08-16 17:08:12-04:00
left-wing wash post slams harris' price controls,0.86,r/republicans,2024-08-17 18:23:09-04:00
harris' economic plan promises voters affordable groceries and homes. don't fall for it.,0.6,r/republicans,2024-08-17 09:31:07-04:00
who do you think europeans want to win? harris or trump?,0.6,r/republicans,2024-08-17 06:16:11-04:00
"a story everyone should know: harris, biden, and gianfranco torres-navarro - washington examiner",0.67,r/republicans,2024-08-17 09:28:54-04:00
"harris follows vance, pitches increased child tax credit",0.79,r/republicans,2024-08-16 13:59:36-04:00
opinion | kamala harris’s price gouging proposal is a terrible idea -…,0.78,r/republicans,2024-08-16 10:48:29-04:00
"trump: ‘i’m better looking than kamala—and don’t say i ramble’ |
back on the rally trail in wilkes-barre, pennsylvania, trump asked the crowd if he could go off teleprompter. and then he did",0.96,r/politics,2024-08-18 08:50:21-04:00
trump vs. harris poised to be largest gender divide in election history,0.92,r/politics,2024-08-18 06:37:55-04:00
tim walz’s gay &amp; bisexual former students praise his life-changing guidance,0.98,r/politics,2024-08-18 09:14:13-04:00
j.d. vance blames ‘fake polls’ for harris’ lead,0.96,r/politics,2024-08-18 10:59:02-04:00
kamala harris erases donald trump's significant lead on mental sharpness,0.94,r/politics,2024-08-18 09:04:29-04:00
"the media’s double standard favors donald trump, not kamala harris",0.97,r/politics,2024-08-18 05:32:21-04:00
pennsylvania is slipping from donald trump’s grasp — kamala harris gains ground with crucial hispanic voters in swing state that could decide 2024 us election,0.98,r/politics,2024-08-18 09:19:02-04:00
jd vance falters with sun belt swing state voters. they're more receptive to tim walz.,0.99,r/politics,2024-08-18 12:44:31-04:00
kamala harris heads to dnc in chicago with momentum and a big opportunity,0.97,r/politics,2024-08-18 06:38:44-04:00
donald trump mocked for saying he's 'better looking' than kamala harris,0.96,r/politics,2024-08-17 21:09:35-04:00
harris campaign books ‘largest ever’ digital ad blitz in $200m effort to reach voters on their phones,0.97,r/politics,2024-08-18 10:41:26-04:00
hail to the chef: vice president kamala harris turns love of cooking into political tool,0.96,r/politics,2024-08-18 09:51:35-04:00
andy beshear says harris’s economic plan to to ensure ‘capitalism stays within the guardrails’,0.97,r/politics,2024-08-18 13:31:23-04:00
"republicans, are you still confused by harris' momentum? blame trump and maga.",0.95,r/politics,2024-08-18 13:27:07-04:00
harris and walz will campaign by bus in pennsylvania before the democratic convention in chicago,0.98,r/politics,2024-08-18 13:27:20-04:00
"biden-harris administration enhances program to build more affordable homes | new update to hud financing program for state and local housing finance agencies will support the construction of new, affordable homes for american families",0.96,r/politics,2024-08-18 13:20:24-04:00
introducing r/whatkamalahasdone - please subscribe today,0.88,r/democrats,2024-08-16 15:28:22-04:00
kamala harris erases donald trump's significant lead on mental sharpness ,0.97,r/democrats,2024-08-18 09:06:55-04:00
house republicans target tim walz in new probe,0.83,r/moderatepolitics,2024-08-17 15:15:10-04:00
harris now aims to eliminate billions in painful medical debt,0.74,r/moderatepolitics,2024-08-16 18:27:10-04:00
"why dem lawmakers are giving harris a pass on policy proposals
",0.57,r/moderatepolitics,2024-08-16 21:17:19-04:00
diocletian and harris on inflation and price-gouging,0.54,r/moderatepolitics,2024-08-16 19:15:35-04:00
the times demand serious economic ideas. harris supplies gimmicks. | ‘price gouging’ is not causing inflation. so why is the vice president promising to stamp it out?,0.5,r/moderatepolitics,2024-08-17 00:19:26-04:00
"donald trump's losing baby boomers, silent generation to kamala harris",0.77,r/moderatepolitics,2024-08-15 12:21:33-04:00
"kamala harris to propose ban on ‘price gouging’ for food, groceries",0.86,r/moderatepolitics,2024-08-15 10:29:33-04:00
"tim walz previously faced criticism over the way he characterized his military service, records show",0.51,r/moderatepolitics,2024-08-15 13:51:35-04:00
"harris follows vance, pitches increased child tax credit",0.8,r/republicans,2024-08-16 13:59:36-04:00
opinion | kamala harris’s price gouging proposal is a terrible idea -…,0.82,r/republicans,2024-08-16 10:48:29-04:00
joe &amp; kamala just got booed into oblivion!! lol,0.67,r/republicans,2024-08-16 17:54:01-04:00
the tim walz situation just got crazy lol,0.5,r/republicans,2024-08-16 17:08:12-04:00
"weeks into her campaign, kamala harris puts forward an economic agenda",0.75,r/republicans,2024-08-16 10:40:53-04:00
‘deeply suspicious’: china expert demands walz be removed from wh ticket over this,0.56,r/republicans,2024-08-16 10:31:24-04:00
voters won’t fall for tim walz’s folksy façade,0.5,r/republicans,2024-08-16 10:57:33-04:00
"tim walz attacks free speech, says misinfo is illegal: robby soave",0.56,r/republicans,2024-08-16 10:06:24-04:00
"harris follows vance, pitches increased child tax credit",0.7,r/republicans,2024-08-16 13:59:36-04:00
opinion | kamala harris’s price gouging proposal is a terrible idea -…,0.75,r/republicans,2024-08-16 10:48:29-04:00
‘deeply suspicious’: china expert demands walz be removed from wh ticket over this,0.5,r/republicans,2024-08-16 10:31:24-04:00
"tim walz attacks free speech, says misinfo is illegal: robby soave",0.58,r/republicans,2024-08-16 10:06:24-04:00
"trump is pissed at harris for trapping him in two debates - donald trump is so mad, it seems he’s about to chicken out of debating kamala harris.",0.92,r/politics,2024-08-16 14:35:46-04:00
tim walz’s ‘white guy tacos’ quip gets maga all hot and bothered,0.92,r/politics,2024-08-16 11:11:26-04:00
democrats warn against overconfidence amid harris momentum,0.98,r/politics,2024-08-16 08:52:59-04:00
harris brings her ad blitz to fox news,0.99,r/politics,2024-08-16 13:13:19-04:00
"kamala harris unveils populist policy agenda, with $6,000 credit for newborns",0.97,r/politics,2024-08-16 07:22:50-04:00
harris to propose up to $25k in down-payment support for 1st-time homebuyers,0.97,r/politics,2024-08-16 11:57:39-04:00
trump warns of 1929-style crash if harris wins – just as fox news ticker shows stock market at near-record high,0.97,r/politics,2024-08-16 07:51:45-04:00
donald trump lies to crowd: tim walz let the state “kidnap children to change their gender”,0.96,r/politics,2024-08-16 15:05:03-04:00
donald trump leading kamala harris by just one point with men: poll,0.93,r/politics,2024-08-16 06:03:26-04:00
"walz is winning the popularity contest, despite gop attacks",0.98,r/politics,2024-08-16 17:46:11-04:00
kamala harris wants to stop wall street’s homebuying spree,0.99,r/politics,2024-08-16 21:25:29-04:00
"kamala harris' popularity rating surges past trump, biden's best in years",0.95,r/politics,2024-08-16 20:16:29-04:00
new poll shows trump leading harris in pennsylvania,0.34,r/politics,2024-08-16 20:09:00-04:00
"the polls have shifted toward harris. is it real, or something else?",0.26,r/politics,2024-08-16 20:56:00-04:00
gop's comer launches investigation into walz's 'engagement' with china,0.23,r/politics,2024-08-16 21:05:46-04:00
harris’ plan to stop price gouging could create more problems than it solves,0.08,r/politics,2024-08-16 20:39:57-04:00
introducing r/whatkamalahasdone - please subscribe today,1.0,r/democrats,2024-08-16 15:28:22-04:00
republicans for kamala harris,0.99,r/democrats,2024-08-16 18:26:16-04:00
had to pivot to questioning kamala's race,0.98,r/democrats,2024-08-16 18:48:56-04:00
