title,upvote_ratio,subreddit_name_prefixed,date
harris campaign raises $36m in 24 hours after walz pick,0.99,r/democrats,2024-08-07 17:27:47-04:00
mormons are organizing for harris — and they could swing the 2024 election,0.99,r/democrats,2024-08-07 10:22:37-04:00
"harris/walz rally in eau claire, wi. this is what democracy looks like!",0.99,r/democrats,2024-08-07 15:11:10-04:00
opinion | democrats have needed someone like tim walz for decades (gift article),0.99,r/democrats,2024-08-07 07:53:35-04:00
"despite new criticism, trump told walz in 2020 he was 'very happy' with his handling of george floyd protests",1.0,r/democrats,2024-08-07 16:39:33-04:00
even tim walz seems kind of shocked by how excited democrats are,0.97,r/democrats,2024-08-07 16:15:47-04:00
kamala and team bring in the people ,0.93,r/democrats,2024-08-06 17:57:40-04:00
how tim walz—kamala harris’ running mate—lost the nra’s support on guns,0.61,r/moderatepolitics,2024-08-07 09:13:43-04:00
"harris selects minnesota gov. tim walz as running mate, aiming to add midwest muscle to ticket",0.93,r/moderatepolitics,2024-08-06 09:05:07-04:00
republicans start attacking walz by going after his military record,0.48,r/moderatepolitics,2024-08-07 22:01:55-04:00
why is tim walz facing accusations of stolen valor?,0.45,r/moderatepolitics,2024-08-07 16:18:39-04:00
yougov/umass poll: harris +3 a 7 point swing from january ,0.76,r/moderatepolitics,2024-08-05 12:00:46-04:00
republicans start attacking walz by going after his military record,0.49,r/moderatepolitics,2024-08-07 22:01:55-04:00
"do you think kamala harris will underperform or overperform the polling this election cycle?
",0.82,r/PoliticalDiscussion,2024-08-04 13:33:42-04:00
why did harris select waltz instead of shapiro for vp?,0.45,r/PoliticalDiscussion,2024-08-06 09:05:12-04:00
walz 101 from a minnesotan,1.0,r/democrats,2024-08-07 21:56:56-04:00
"quick question: i want to cast my vote for the harris ticket, but i live part time in two states — west virginia and nc. ",0.75,r/democrats,2024-08-07 21:34:51-04:00
"'if you want donald trump to win, then say that': harris fires back at gaza protesters at rally",0.79,r/politics,2024-08-07 22:25:51-04:00
j.d. vance accuses 24-year army veteran tim walz of ‘stolen valor’,0.91,r/politics,2024-08-07 21:29:43-04:00
even tim walz seems kind of shocked by how excited democrats are,0.98,r/democrats,2024-08-07 16:15:47-04:00
republicans start attacking walz by going after his military record,0.5,r/moderatepolitics,2024-08-07 22:01:55-04:00
why is tim walz facing accusations of stolen valor?,0.44,r/moderatepolitics,2024-08-07 16:18:39-04:00
"can the harris campaign change the ""open borders"" narrative with recent border crossing data?",0.58,r/PoliticalDiscussion,2024-08-05 22:52:50-04:00
"can the harris campaign change the ""open borders"" narrative with recent border crossing data?",0.53,r/PoliticalDiscussion,2024-08-05 22:52:50-04:00
"quick question: i want to cast my vote for the harris ticket, but i live part time in two states — west virginia and nc. ",0.7,r/democrats,2024-08-07 21:34:51-04:00
harris-walz campaign says it raised $36 million in first 24 hours after running mate revealed,0.98,r/politics,2024-08-07 20:26:20-04:00
'i'm speaking!' harris says to protesters at her campaign rally,0.75,r/politics,2024-08-07 20:49:06-04:00
tim walz charms wisconsin crowd with his midwest dad vibes,0.96,r/politics,2024-08-07 20:34:27-04:00
harris leads trump in yougov poll for second week in a row,1.0,r/politics,2024-08-07 20:47:14-04:00
trump in 2020 praised tim walz’s handling of george floyd protests,0.98,r/politics,2024-08-07 19:50:59-04:00
trump picks a nickname for harris that no one seems to understand,0.87,r/politics,2024-08-07 20:45:22-04:00
minnesota’s jews celebrate as their ‘mensch’ gov. tim walz enters the national spotlight,0.89,r/politics,2024-08-07 19:59:07-04:00
trump complains about campaign as advisers try to focus on attacking harris,0.92,r/politics,2024-08-07 20:11:32-04:00
jd vance mocked for 'kamala chaos' stage gaffe in philly rally,0.96,r/politics,2024-08-07 20:00:46-04:00
tim walz suddenly stops campaign rally after noticing someone needs help,0.92,r/politics,2024-08-07 16:01:54-04:00
