title,upvote_ratio,subreddit_name_prefixed,date
"walz is winning the popularity contest, despite gop attacks",0.97,r/democrats,2024-08-16 17:48:35-04:00
"trump warns that if kamala harris wins, ‘everybody gets health care’",0.98,r/democrats,2024-08-15 21:07:23-04:00
gop pollster says trump ‘committing political suicide’ as harris seizes ‘intensity advantage’,0.96,r/democrats,2024-08-16 15:51:42-04:00
harris now aims to eliminate billions in painful medical debt,0.7,r/moderatepolitics,2024-08-16 18:27:10-04:00
harris has proposed a slew of economic policies. here’s a look at what’s in them,0.76,r/moderatepolitics,2024-08-16 16:38:30-04:00
kamala harris wants to ban grocery price gouging. what economists think of price controls,0.77,r/moderatepolitics,2024-08-16 10:19:14-04:00
"why dem lawmakers are giving harris a pass on policy proposals
",0.46,r/moderatepolitics,2024-08-16 21:17:19-04:00
diocletian and harris on inflation and price-gouging,0.44,r/moderatepolitics,2024-08-16 19:15:35-04:00
walz rebrands progressive wins as household realities,0.8,r/moderatepolitics,2024-08-14 09:07:32-04:00
"kamala harris, tim walz interview each other in policy-free discussion as both continue to dodge press",0.38,r/moderatepolitics,2024-08-16 10:26:25-04:00
"tim walz previously faced criticism over the way he characterized his military service, records show",0.52,r/moderatepolitics,2024-08-15 13:51:35-04:00
"kamala harris has revealed her economic plan, what are your opinions?",0.95,r/PoliticalDiscussion,2024-08-16 17:20:19-04:00
what could kamala harris do to pursue her economic agenda without the us senate on her side?,1.0,r/PoliticalDiscussion,2024-08-16 14:22:59-04:00
"as the polling shows harris increasing her lead, should she expand her campaign to more battleground states or focus on the tipping point states?",0.93,r/PoliticalDiscussion,2024-08-14 12:14:36-04:00
harris and trump have now both advocated for ending taxes on tips. what are the arguments for and against this? what would implementation look like?,0.94,r/PoliticalDiscussion,2024-08-13 13:26:02-04:00
could a major protest / disruption at the democratic national convention actually hurt kamala harris's chances at winning the presidency?,0.33,r/PoliticalDiscussion,2024-08-15 05:28:12-04:00
what do you think the reason is for kamala harris not doing any interviews? ,0.26,r/PoliticalDiscussion,2024-08-15 05:04:53-04:00
could a major protest / disruption at the democratic national convention actually hurt kamala harris's chances at winning the presidency?,0.32,r/PoliticalDiscussion,2024-08-15 05:28:12-04:00
"on a scrambled 2024 map, north carolina democrats say harris has a shot",0.94,r/democrats,2024-08-16 21:06:24-04:00
'a roller coaster': harris' sudden rise resets a tight battle for the house,1.0,r/democrats,2024-08-16 21:10:41-04:00
"harris follows vance, pitches increased child tax credit",0.78,r/republicans,2024-08-16 13:59:36-04:00
opinion | kamala harris’s price gouging proposal is a terrible idea -…,0.77,r/republicans,2024-08-16 10:48:29-04:00
‘deeply suspicious’: china expert demands walz be removed from wh ticket over this,0.67,r/republicans,2024-08-16 10:31:24-04:00
‘deeply suspicious’: china expert demands walz be removed from wh ticket over this,0.75,r/republicans,2024-08-16 10:31:24-04:00
"tim walz attacks free speech, says misinfo is illegal: robby soave",0.54,r/republicans,2024-08-16 10:06:24-04:00
"the polls have shifted toward harris. is it real, or something else?",0.28,r/politics,2024-08-16 20:56:00-04:00
harris now aims to eliminate billions in painful medical debt,0.71,r/moderatepolitics,2024-08-16 18:27:10-04:00
diocletian and harris on inflation and price-gouging,0.45,r/moderatepolitics,2024-08-16 19:15:35-04:00
harris has proposed a slew of economic policies. here’s a look at what’s in them,0.75,r/moderatepolitics,2024-08-16 16:38:30-04:00
could a major protest / disruption at the democratic national convention actually hurt kamala harris's chances at winning the presidency?,0.35,r/PoliticalDiscussion,2024-08-15 05:28:12-04:00
"on a scrambled 2024 map, north carolina democrats say harris has a shot",1.0,r/democrats,2024-08-16 21:06:24-04:00
"walz is winning the popularity contest, despite gop attacks",0.96,r/democrats,2024-08-16 17:48:35-04:00
"rfk jr. rebukes democrats, won't endorse kamala",0.67,r/republicans,2024-08-15 16:07:01-04:00
kamala harris is now proposing raising crypto tax to 28%,0.75,r/republicans,2024-08-14 20:56:49-04:00
"minnesota bar owner: gov. tim walz destroyed my business “god help us all if he is in the white house and has anything to say with what goes on in our country,” zarza told “wake up america.” #scamalaharris #democrat2024 #tyranny #dictatorship #farleft #radical",0.67,r/republicans,2024-08-13 21:30:53-04:00
jd vance refuses to commit to vp debate – after tim walz tells him ‘see you on october 1’,0.92,r/politics,2024-08-15 07:10:33-04:00
"august 2024 national poll: harris 50%, trump 46%",0.95,r/politics,2024-08-15 08:29:44-04:00
"kamala harris' chances of winning a landslide, according to polls",0.91,r/politics,2024-08-15 10:43:44-04:00
kamala harris jumps 14 points with latino voters in new poll,0.97,r/politics,2024-08-15 12:09:20-04:00
biden rips trump as ‘donald dump’ while signaling unity with harris,0.98,r/politics,2024-08-15 14:50:02-04:00
walz says he’ll make debate with jd vance all about project 2025,0.98,r/politics,2024-08-15 08:07:17-04:00
harris vs. trump latest presidential poll: trump has nowhere to go to find voters,0.98,r/politics,2024-08-15 08:54:19-04:00
joe rogan again dings trump by saying harris ‘nailed’ major speech,0.95,r/politics,2024-08-15 13:36:32-04:00
tim walz served 24 years in military. donald trump dodged the draft. which is better?,0.97,r/politics,2024-08-15 10:19:01-04:00
"donald trump's losing baby boomers, silent generation to kamala harris",0.96,r/politics,2024-08-15 09:21:43-04:00
vance and walz agree to vp debate,0.97,r/politics,2024-08-15 10:32:45-04:00
kamala harris leads donald trump in five key swing states,0.96,r/politics,2024-08-15 13:04:26-04:00
tim walz is popular. jd vance is not.,0.98,r/politics,2024-08-15 14:30:21-04:00
harris backed by major latino voter group: ‘she understands immigrants’,0.98,r/politics,2024-08-15 11:19:54-04:00
"'thank you, joe' chants break out at 1st joint biden, harris event since exiting race",0.98,r/politics,2024-08-15 16:01:58-04:00
"biden praises harris in first joint event, saying she will make ""one hell of a president""",0.99,r/politics,2024-08-15 15:30:15-04:00
former student: tim walz doesn't know he saved my life,0.98,r/politics,2024-08-15 15:05:58-04:00
"biden, harris hail medicare drug price cuts that will save billions",0.98,r/politics,2024-08-15 15:19:33-04:00
jd vance agrees to october vice-presidential debate with tim walz,0.89,r/politics,2024-08-15 16:12:11-04:00
emerson national poll: harris 50%/trump 46%,0.96,r/democrats,2024-08-15 09:58:36-04:00
can kamala harris turn texas blue?,0.98,r/democrats,2024-08-15 12:09:13-04:00
harris to call for federal ban on price-gouging in friday speech,1.0,r/democrats,2024-08-15 09:33:43-04:00
media concerned 3 months is not enough time to destroy the harris campaign,0.98,r/democrats,2024-08-15 11:24:50-04:00
"should we organize a large-scale fundraising campaign for harris/walz to effectively counter any potential surge in support for trump if judge marchand convicts him in september, similar to the boost he received after his georgia charges and the assassination attempt?",0.96,r/democrats,2024-08-15 13:22:07-04:00
"woman knowingly breaks law six times, is surprised when jailed, blames tim walz because clearly she was more important than some dumb pandemic!",0.95,r/democrats,2024-08-15 07:43:52-04:00
right-wing media attack tim walz for having the financial portfolio of an average american,0.99,r/democrats,2024-08-14 23:03:39-04:00
full list of republicans endorsing kamala harris,0.99,r/democrats,2024-08-15 03:02:54-04:00
biden to join harris at md. event; trump to hold news conference,1.0,r/democrats,2024-08-15 13:26:51-04:00
"donald trump's losing baby boomers, silent generation to kamala harris",0.73,r/moderatepolitics,2024-08-15 12:21:33-04:00
the march of kamala's brides,0.47,r/moderatepolitics,2024-08-15 16:15:03-04:00
fact sheet: biden-harris administration takes new actions to lower housing costs by cutting red tape to build more housing,0.79,r/moderatepolitics,2024-08-14 02:01:35-04:00
"tim walz previously faced criticism over the way he characterized his military service, records show",0.45,r/moderatepolitics,2024-08-15 13:51:35-04:00
harris-sponsored google ads put news outlets in a tough spot,0.87,r/moderatepolitics,2024-08-13 16:32:01-04:00
secret service apologizes after breaking into massachusetts salon to use bathroom before harris fundraiser,0.9,r/moderatepolitics,2024-08-12 19:58:12-04:00
"harris says she supports eliminating taxes on tips, like trump",0.9,r/moderatepolitics,2024-08-12 17:18:31-04:00
the march of kamala's brides,0.56,r/moderatepolitics,2024-08-15 16:15:03-04:00
"tim walz previously faced criticism over the way he characterized his military service, records show",0.46,r/moderatepolitics,2024-08-15 13:51:35-04:00
what do you think the reason is for kamala harris not doing any interviews? ,0.25,r/PoliticalDiscussion,2024-08-15 05:04:53-04:00
biden to join harris at md. event; trump to hold news conference,0.98,r/democrats,2024-08-15 13:26:51-04:00
kamala harris and her long history of faith-based bigotry,1.0,r/republicans,2024-08-13 09:41:53-04:00
"even after dr. anthony fauci admitted he lied 12 times about covid and vaccines, supposedly to keep the public calm, kamala harris still calls him an ""american hero"".  his mistakes, lies, and deceptions cost thousands of lives, school closings, and a $500,000,000 hit to the american economy.",0.6,r/republicans,2024-08-12 16:07:09-04:00
has the media bias ever been so blatant for one candidate? queen kamala calls 18 to 24 year olds stupid…but wait…that’s not what she meant 😂. if this was djt the world would be ablaze.,0.53,r/republicans,2024-08-12 16:24:48-04:00
kamala harris finally agrees to take questions from reporters after three weeks of silent evasion,0.36,r/republicans,2024-08-12 16:18:07-04:00
harris and walz fiddled as minneapolis burned during blm riots,0.52,r/republicans,2024-08-12 11:17:44-04:00
trump takes back his lead vs kamala harris in latest set of polls!!!!!,0.57,r/republicans,2024-08-11 18:11:33-04:00
"how can someone vote democrat without an id, but they have to show id to see queen kamala? one scenario is “racist” while the other is what??? ",0.56,r/republicans,2024-08-11 15:08:37-04:00
"even after dr. anthony fauci admitted he lied 12 times about covid and vaccines, supposedly to keep the public calm, kamala harris still calls him an ""american hero"".  his mistakes, lies, and deceptions cost thousands of lives, school closings, and a $500,000,000 hit to the american economy.",0.54,r/republicans,2024-08-12 16:07:09-04:00
has the media bias ever been so blatant for one candidate? queen kamala calls 18 to 24 year olds stupid…but wait…that’s not what she meant 😂. if this was djt the world would be ablaze.,0.57,r/republicans,2024-08-12 16:24:48-04:00
harris and walz fiddled as minneapolis burned during blm riots,0.54,r/republicans,2024-08-12 11:17:44-04:00
trump takes back his lead vs kamala harris in latest set of polls!!!!!,0.58,r/republicans,2024-08-11 18:11:33-04:00
"how can someone vote democrat without an id, but they have to show id to see queen kamala? one scenario is “racist” while the other is what??? ",0.57,r/republicans,2024-08-11 15:08:37-04:00
kamala harris takes nine point lead over donald trump in wisconsin poll,0.96,r/politics,2024-08-13 05:04:53-04:00
bizarre moment trump says ‘beautiful’ kamala harris looks like wife melania in elon musk x interview,0.98,r/politics,2024-08-13 08:02:20-04:00
"after trump’s disastrous musk interview, harris mocks ‘rich guys’ who can’t run a livestream",0.97,r/politics,2024-08-13 00:12:39-04:00
ignore the media haters. the ‘harris honeymoon’ is far from over,0.96,r/politics,2024-08-13 07:44:14-04:00
"donald trump, who is definitely not melting down over kamala harris’s popularity, demands his opponent be “disqualified” from the election",0.94,r/politics,2024-08-12 15:33:33-04:00
"kamala harris's campaign mocks x interview with donald trump, elon musk  as ‘self-obsessed rich guys … who cannot run a livestream’",0.98,r/politics,2024-08-13 08:11:13-04:00
‘never trumpers’ line up to support vice president kamala harris for president,0.98,r/politics,2024-08-12 21:55:32-04:00
kamala harris mocks donald trump's interview disaster on truth social,0.93,r/politics,2024-08-13 09:24:57-04:00
surprise poll shows harris is stealing these battleground voters from trump,0.88,r/politics,2024-08-13 08:44:20-04:00
the latest: harris begins policy rollout; material from trump campaign leaked to news outlets,0.96,r/politics,2024-08-13 09:35:57-04:00
jon stewart compares trump’s remixed harris attacks to an elton john song,0.96,r/politics,2024-08-13 09:35:36-04:00
harris to detail plans to cut costs in key policy speech in north carolina,1.0,r/politics,2024-08-13 09:22:55-04:00
"feeling heat from harris, trump breaks glass",0.88,r/politics,2024-08-13 08:41:50-04:00
23 days: kamala harris has not held a press conference since emerging as presumptive democratic nominee,0.04,r/politics,2024-08-13 08:58:29-04:00
walz’s handling of george floyd protests draws fresh scrutiny,0.05,r/politics,2024-08-13 09:23:21-04:00
latest harris-trump poll highlights danger for former president in florida,0.97,r/democrats,2024-08-13 06:40:43-04:00
"poll: harris leading in wi 9%, mi 6%, pa 4%",0.95,r/democrats,2024-08-12 15:48:16-04:00
former n.y. republican rep. susan molinari backs harris for president,0.98,r/democrats,2024-08-13 06:23:18-04:00
kamala harris mocks donald trump's x interview disaster on truth social,0.98,r/democrats,2024-08-13 03:48:10-04:00
"even if kamala wins the electoral college, will she be president? ",0.87,r/democrats,2024-08-12 13:04:59-04:00
kamala harris scores time magazine cover: ‘the swiftest vibe shift in modern political history’,0.97,r/democrats,2024-08-12 11:00:26-04:00
wouldn't it be a real stick-it-to-em moment if a bunch of us donated to the harris campaing during the elon x trump propaganda broadcast?,0.96,r/democrats,2024-08-12 22:13:54-04:00
secret service apologizes after breaking into massachusetts salon to use bathroom before harris fundraiser,0.88,r/moderatepolitics,2024-08-12 19:58:12-04:00
trump rages 'election interference' with claim kamala harris rally crowds are fake,0.83,r/moderatepolitics,2024-08-11 13:54:39-04:00
kamala harris is more trusted than donald trump on the us economy,0.7,r/moderatepolitics,2024-08-11 10:21:14-04:00
"tim walz ‘misspoke’ when he discussed using weapons ‘in war,’ campaign says",0.71,r/moderatepolitics,2024-08-11 13:15:21-04:00
"harris leads trump in three key states, times/siena polls find",0.77,r/moderatepolitics,2024-08-10 09:16:48-04:00
"gov. tim walz on ""white dudes for kamala harris"" call: ""one person's socialism is another person's neighborliness""",0.81,r/moderatepolitics,2024-08-09 09:56:52-04:00
"trump hits harris on guns, says shooting didn’t change his view on ar-15s",0.8,r/moderatepolitics,2024-08-09 11:03:23-04:00
trump says he has agreed to offer from abc news to debate harris,0.94,r/moderatepolitics,2024-08-08 15:18:48-04:00
how will donald trump being an incumbent help or harm the harris-walz campaign?,0.16,r/PoliticalDiscussion,2024-08-13 03:57:54-04:00
how will lifelong republican and arizona mayor john giles speaking in support of harris-walz influence the voting of other centrist republicans?,0.95,r/PoliticalDiscussion,2024-08-10 12:52:13-04:00
"if biden died of old age between now and november, and harris became president, would that somehow help or hinder her campaign?",0.86,r/PoliticalDiscussion,2024-08-10 14:43:23-04:00
what would happen if kamala harris is declared the winner but loses the electoral college due to a faithless elector?,0.88,r/PoliticalDiscussion,2024-08-10 10:17:55-04:00
which state(s) could kamala and walz *realistically* try to win that she and biden did not win in 2020 (flip from red to blue)?,0.94,r/PoliticalDiscussion,2024-08-09 19:27:01-04:00
harris campaign should be making all these stops,1.0,r/democrats,2024-08-13 09:16:56-04:00
kamala harris mocks donald trump's x interview disaster on truth social,0.99,r/democrats,2024-08-13 03:48:10-04:00
"how can someone vote democrat without an id, but they have to show id to see queen kamala? one scenario is “racist” while the other is what??? ",0.65,r/republicans,2024-08-11 15:08:37-04:00
"walz, a political chameleon, turns very blue",1.0,r/republicans,2024-08-11 13:54:37-04:00
can harris and walz keep hiding who they are? - john kass,0.6,r/republicans,2024-08-11 13:37:22-04:00
"the media is, in unison, joyous for kamala -- totally random right?",0.57,r/republicans,2024-08-11 12:17:33-04:00
tim walz’ stolen valor,0.2,r/republicans,2024-08-11 13:07:15-04:00
"how can someone vote democrat without an id, but they have to show id to see queen kamala? one scenario is “racist” while the other is what??? ",0.66,r/republicans,2024-08-11 15:08:37-04:00
trump takes back his lead vs kamala harris in latest set of polls!!!!!,0.56,r/republicans,2024-08-11 18:11:33-04:00
tim walz’ stolen valor,0.22,r/republicans,2024-08-11 13:07:15-04:00
trump rolls out bonkers harris plane conspiracy—but photographer disproves it,0.97,r/politics,2024-08-11 19:09:38-04:00
kamala harris ties donald trump in state he won in 2016 and 2020: poll,0.95,r/politics,2024-08-11 16:55:49-04:00
"i was right to go, biden says, as harris leads trump in key states",0.98,r/politics,2024-08-11 19:11:21-04:00
"trump falsely claims harris rally crowd ‘didn’t exist,’ was ai-generated",0.96,r/politics,2024-08-11 13:54:30-04:00
"jan. 6 officers hit the road for harris, hoping to make trump lose another election",0.98,r/politics,2024-08-11 16:49:56-04:00
kamala harris campaign responds to trump's proposed debate schedule,0.96,r/politics,2024-08-11 10:34:08-04:00
"harris edges out trump on who voters trust more with the economy, new poll finds",0.98,r/politics,2024-08-11 19:47:18-04:00
trump falsely claims that the crowds seen at harris rallies are fake,0.95,r/politics,2024-08-11 23:15:50-04:00
kamala harris is more trusted than donald trump on the us economy,0.94,r/politics,2024-08-11 08:30:41-04:00
kamala harris scores triple boost in battleground polls,0.92,r/politics,2024-08-12 06:38:24-04:00
tim walz gets nuked by his former battalion leader: 'he did not earn the rank',0.03,r/politics,2024-08-12 06:49:18-04:00
"trump has psychological break from reality, falsely claiming kamala harris’ massive crowds are ‘ai and fake’",0.97,r/democrats,2024-08-11 20:01:06-04:00
north carolina poll: harris ties trump; stein leads for governor,0.99,r/democrats,2024-08-11 15:28:36-04:00
harris / walz rally in las vegas ,0.98,r/democrats,2024-08-11 18:06:04-04:00
kamala harris is more trusted than donald trump on the us economy,0.92,r/democrats,2024-08-12 01:17:45-04:00
trump rages 'election interference' with claim kamala harris rally crowds are fake,0.82,r/moderatepolitics,2024-08-11 13:54:39-04:00
"tim walz ‘misspoke’ when he discussed using weapons ‘in war,’ campaign says",0.7,r/moderatepolitics,2024-08-11 13:15:21-04:00
"kamala harris, tim walz push ar-15 ban in first joint campaign appearance",0.76,r/moderatepolitics,2024-08-08 07:34:03-04:00
"vp candidate tim walz on ""there's no guarantee to free speech on misinformation or hate speech, and especially around our democracy""",0.63,r/moderatepolitics,2024-08-08 13:34:29-04:00
i'm a gun owner and hunter. gov. walz doesn’t speak for me,0.42,r/moderatepolitics,2024-08-10 11:54:27-04:00
"trump holds 2-point lead over harris with a big advantage on economy, cnbc survey shows",0.71,r/moderatepolitics,2024-08-08 10:34:07-04:00
"in a scenario where neither candidate gets to 270 electoral votes, and harris wins the contingent election in the house of representatives, if republicans controlled the senate, who would they choose for vice president?",0.73,r/PoliticalDiscussion,2024-08-09 22:10:54-04:00
"trump has agreed to debate kamala harris, what are your early predictions for the outcome?",0.95,r/PoliticalDiscussion,2024-08-08 17:12:18-04:00
what campaign tactics has the harris campaign adopted / stolen from the trump campaign to make their operation better?,0.39,r/PoliticalDiscussion,2024-08-10 21:24:30-04:00
"in a scenario where neither candidate gets to 270 electoral votes, and harris wins the contingent election in the house of representatives, if republicans controlled the senate, who would they choose for vice president?",0.74,r/PoliticalDiscussion,2024-08-09 22:10:54-04:00
what campaign tactics has the harris campaign adopted / stolen from the trump campaign to make their operation better?,0.38,r/PoliticalDiscussion,2024-08-10 21:24:30-04:00
"how can someone vote democrat without an id, but they have to show id to see queen kamala? one scenario is “racist” while the other is what??? ",0.5,r/republicans,2024-08-11 15:08:37-04:00
can harris and walz keep hiding who they are? - john kass,0.5,r/republicans,2024-08-11 13:37:22-04:00
tim walz’ stolen valor,0.25,r/republicans,2024-08-11 13:07:15-04:00
ok here’s harris’ “accomplishment” talking points. all you need to do is disprove these or develop an argument against them and they have nothing.,0.5,r/republicans,2024-08-11 02:36:47-04:00
ok here’s harris’ “accomplishment” talking points. all you need to do is disprove these or develop an argument against them and they have nothing.,0.46,r/republicans,2024-08-11 02:36:47-04:00
kamala harris campaign responds to trump's proposed debate schedule,0.97,r/politics,2024-08-11 10:34:08-04:00
"trump falsely claims harris rally crowd ‘didn’t exist,’ was ai-generated",0.98,r/politics,2024-08-11 13:54:30-04:00
biden to campaign for harris in battleground state pennsylvania,0.98,r/politics,2024-08-11 11:17:01-04:00
vibes matter: trump can hardly restrain his jealousy over the harris campaign's joy,0.97,r/politics,2024-08-11 07:48:44-04:00
get ready now: republicans will refuse to certify a harris win,0.98,r/politics,2024-08-11 14:28:31-04:00
"she once stormed the capitol for trump. now, she’ll be supporting kamala harris in november",0.94,r/politics,2024-08-11 10:52:31-04:00
trump 2024 victory would lock in far right scotus for generations to come | biden and harris favor term limits and an ethical code for the supreme court and elimination of presidential immunity.,0.98,r/politics,2024-08-11 10:12:18-04:00
democrats’ joy is unconfined as harris and walz take upbeat message on tour,0.98,r/politics,2024-08-11 08:10:33-04:00
"to save conservatism from itself, i am voting for harris",0.95,r/politics,2024-08-11 12:33:13-04:00
harris is beating trump by transcending him,0.97,r/politics,2024-08-11 11:34:46-04:00
"for these voters, tim walz is the dad they wish they had",0.96,r/politics,2024-08-11 06:44:29-04:00
vance doubles down on kamala harris not being black enough to call herself black.,0.93,r/politics,2024-08-11 15:58:07-04:00
"insecure trump lies, claims harris crowd was manipulated with ai",0.96,r/politics,2024-08-11 15:20:24-04:00
"insecure trump lies, claims harris crowd was manipulated with ai |
the former president has also falsely accused his opponents of paying people to attend their rallies",0.87,r/politics,2024-08-11 15:49:15-04:00
maga ‘plagiarism’ meltdown over kamala ‘copying’ trump idea,0.86,r/politics,2024-08-11 15:33:34-04:00
witnessed the power of the administrative state – secret service enters salon owner’s premises to use her bathroom before a kamala harris event,0.05,r/politics,2024-08-11 15:42:57-04:00
ex-minnesota bar owner whose family-run business was torched in 2020 riots rips ‘criminal’ gov. tim walz: ‘complete loss of leadership’,0.02,r/politics,2024-08-11 14:58:28-04:00
"even though kamala harris will likely take over next year, i'll probably miss joe biden. he represents a much more innocent time in our country. 😭",0.87,r/democrats,2024-08-11 00:21:22-04:00
new polls show walz’s approval rating surging while vance’s circles the drain,0.99,r/democrats,2024-08-11 14:08:18-04:00
north carolina poll: harris ties trump; stein leads for governor,1.0,r/democrats,2024-08-11 15:28:36-04:00
arizona republican mayor torches trump in powerful harris rally speech,1.0,r/democrats,2024-08-11 08:39:47-04:00
"tim walz ‘misspoke’ when he discussed using weapons ‘in war,’ campaign says",0.69,r/moderatepolitics,2024-08-11 13:15:21-04:00
vance jokes he's checking out his future vp plane while overlapping with harris at wisconsin airport,0.75,r/moderatepolitics,2024-08-08 10:14:31-04:00
how will lifelong republican and arizona mayor john giles speaking in support of harris-walz influence the voting of other centrist republicans?,0.96,r/PoliticalDiscussion,2024-08-10 12:52:13-04:00
"if biden died of old age between now and november, and harris became president, would that somehow help or hinder her campaign?",0.85,r/PoliticalDiscussion,2024-08-10 14:43:23-04:00
which state(s) could kamala and walz *realistically* try to win that she and biden did not win in 2020 (flip from red to blue)?,0.93,r/PoliticalDiscussion,2024-08-09 19:27:01-04:00
is harris likely to become the next president and how close will it be compared to previous elections?,0.67,r/PoliticalDiscussion,2024-08-09 11:08:34-04:00
