title,upvote_ratio,subreddit_name_prefixed,date
"in a scenario where neither candidate gets to 270 electoral votes, and harris wins the contingent election in the house of representatives, if republicans controlled the senate, who would they choose for vice president?",0.72,r/PoliticalDiscussion,2024-08-09 22:10:54-04:00
new polls show walz’s approval rating surging while vance’s circles the drain,1.0,r/democrats,2024-08-11 14:08:18-04:00
get ready now: republicans will refuse to certify a harris win,0.97,r/politics,2024-08-11 14:28:31-04:00
look what was found on kamala harris' campaign website!! wow,0.57,r/republicans,2024-08-10 17:21:32-04:00
this random little kid just exposed kamala harris' secret network of paid shills,0.33,r/republicans,2024-08-10 18:53:32-04:00
this is what it's like working with tim walz: top minnesota republican lisa demuth,0.5,r/republicans,2024-08-10 17:24:59-04:00
the term “second-class citizen” never fit so perfectly. what else will us citizens lose to illegal immigrants if queen kamala wins? ,0.63,r/republicans,2024-08-10 11:57:10-04:00
trump plays viral gaffe supercut of kamala harris on the jumbotron at montana campaign rally,0.57,r/republicans,2024-08-10 11:54:23-04:00
did walz abandon his military unit?!?!,0.41,r/republicans,2024-08-10 12:11:23-04:00
kamala harris gets denied invitation to massive online show lol,0.48,r/republicans,2024-08-09 21:57:39-04:00
vice president kamala harris' rally in detroit descends into 'complete chaos' - videos of event cast doubt about her leadership,0.56,r/republicans,2024-08-09 14:08:04-04:00
the term “second-class citizen” never fit so perfectly. what else will us citizens lose to illegal immigrants if queen kamala wins? ,0.56,r/republicans,2024-08-10 11:57:10-04:00
trump plays viral gaffe supercut of kamala harris on the jumbotron at montana campaign rally,0.5,r/republicans,2024-08-10 11:54:23-04:00
did walz abandon his military unit?!?!,0.47,r/republicans,2024-08-10 12:11:23-04:00
kamala harris gets denied invitation to massive online show lol,0.5,r/republicans,2024-08-09 21:57:39-04:00
kamala harris campaign trolls trump with video of empty seats at his rally,0.94,r/politics,2024-08-10 12:28:28-04:00
"report: trump calls harris a ""bitch""",0.89,r/politics,2024-08-10 09:35:25-04:00
trump reportedly refers to harris as a 'bitch' in private,0.96,r/politics,2024-08-10 14:27:24-04:00
donald trump privately rants that kamala harris is a ‘b***h’ as his polls plunge,0.96,r/politics,2024-08-10 15:17:23-04:00
"kamala harris leads trump in the critical swing states of michigan, pennsylvania, and wisconsin, new poll says",0.98,r/politics,2024-08-10 14:58:10-04:00
"arizona republican mayor blasts 'out of touch' gop while backing kamala harris |
mesa mayor john giles declared that he's putting his ""country over party"" at a campaign rally for the vice president.",0.99,r/politics,2024-08-10 09:47:27-04:00
republicans who think ‘tampon tim’ is an insult are actually walz’s best publicists,0.98,r/politics,2024-08-10 11:59:17-04:00
trump bizarrely claims nobody knows his democratic rival’s last name (it’s harris),0.97,r/politics,2024-08-10 12:22:03-04:00
tim walz is riding the wave of the vibes election: this moment is all about feelings. enter a friendly midwestern governor armed with dad jokes.,0.98,r/politics,2024-08-10 11:00:03-04:00
"kamala harris winning over white voters from trump, polling suggests",0.94,r/politics,2024-08-10 04:06:01-04:00
harris leads trump in three key states times siena polls find,0.97,r/politics,2024-08-10 06:36:21-04:00
'we're not going back': seniors agree with kamala harris and tim walz - we’re not going back on social security. we're not going back on medicare. we're not going back on lower drug prices.,0.98,r/politics,2024-08-10 12:09:13-04:00
'our lives are on the line': why many lgbtq+ people hope for a harris win ,0.95,r/politics,2024-08-10 09:18:49-04:00
new polls show walz’s approval rating surging while vance’s circles the drain,0.98,r/politics,2024-08-10 17:33:36-04:00
trump still pining for biden as messaging sputters against kamala harris,0.98,r/politics,2024-08-10 14:56:39-04:00
tim walz is dressing the part — and it's exactly what harris needs,0.97,r/politics,2024-08-10 11:15:42-04:00
what project 2025 means for ivf and why it matters to tim walz,0.98,r/politics,2024-08-10 18:32:57-04:00
harris and walz hold las vegas rally as pair build on renewed 2024 enthusiasm,0.99,r/politics,2024-08-10 17:54:24-04:00
why trump’s mifepristone comments were a gift to the harris campaign,0.99,r/politics,2024-08-10 17:50:38-04:00
tim walz is a map nerd,0.95,r/politics,2024-08-10 18:45:49-04:00
"harris leads trump in three major election battlegrounds, new poll finds",0.97,r/politics,2024-08-10 17:51:20-04:00
how tim walz got so savage,0.95,r/politics,2024-08-10 17:56:13-04:00
harris rally 8/9 vs trump rally 8/9,0.99,r/democrats,2024-08-10 12:09:01-04:00
watch pete buttigieg fact-check conservative media smears of tim walz,0.99,r/democrats,2024-08-10 07:54:57-04:00
trump's broken-down helicopter was a vehicle to make up shit about kamala harris,0.98,r/democrats,2024-08-10 11:23:44-04:00
"harris leads trump in three key states, times/siena polls find",0.98,r/democrats,2024-08-10 09:31:29-04:00
jesse ventura endorses kamala harris for president of the united states of america,0.98,r/democrats,2024-08-10 00:55:35-04:00
"harris takes the lead in critical blue wall states, new poll finds",0.97,r/democrats,2024-08-10 15:29:00-04:00
what do you see in kamala?,0.79,r/democrats,2024-08-09 18:41:16-04:00
kamala harris calls for ceasefire in gaza 🇵🇸,0.95,r/democrats,2024-08-10 09:08:32-04:00
republican mayor of mesa az enthusiastically endorses kamala harris for president,0.99,r/democrats,2024-08-10 12:30:26-04:00
"harris leads trump in three key states, times/siena polls find",0.76,r/moderatepolitics,2024-08-10 09:16:48-04:00
"kamala harris, tim walz push ar-15 ban in first joint campaign appearance",0.75,r/moderatepolitics,2024-08-08 07:34:03-04:00
i'm a gun owner and hunter. gov. walz doesn’t speak for me,0.4,r/moderatepolitics,2024-08-10 11:54:27-04:00
kamala takes 6 point lead among likely in new marquette poll.,0.74,r/moderatepolitics,2024-08-08 07:54:32-04:00
harris responds to gaza protesters at rally: ‘i am speaking now’,0.87,r/moderatepolitics,2024-08-07 23:34:58-04:00
"in 60-year-old tim walz, kamala harris found a partner to advocate for reproductive rights",0.53,r/moderatepolitics,2024-08-08 12:02:17-04:00
"despite new criticism, trump told walz in 2020 he was 'very happy' with his handling of george floyd protests",0.84,r/moderatepolitics,2024-08-07 16:38:53-04:00
i'm a gun owner and hunter. gov. walz doesn’t speak for me,0.41,r/moderatepolitics,2024-08-10 11:54:27-04:00
what would happen if kamala harris is declared the winner but loses the electoral college due to a faithless elector?,0.87,r/PoliticalDiscussion,2024-08-10 10:17:55-04:00
"if biden died of old age between now and november, and harris became president, would that somehow help or hinder her campaign?",0.78,r/PoliticalDiscussion,2024-08-10 14:43:23-04:00
"in a scenario where neither candidate gets to 270 electoral votes, and harris wins the contingent election in the house of representatives, if republicans controlled the senate, who would they choose for vice president?",0.76,r/PoliticalDiscussion,2024-08-09 22:10:54-04:00
"if biden died of old age between now and november, and harris became president, would that somehow help or hinder her campaign?",0.76,r/PoliticalDiscussion,2024-08-10 14:43:23-04:00
is harris likely to become the next president and how close will it be compared to previous elections?,0.64,r/PoliticalDiscussion,2024-08-09 11:08:34-04:00
vice president kamala harris' rally in detroit descends into 'complete chaos' - videos of event cast doubt about her leadership,0.58,r/republicans,2024-08-09 14:08:04-04:00
newly found video just rocked the kamala campaign!!! tim walz is done.,0.42,r/republicans,2024-08-09 20:16:58-04:00
"
the harris flop would be scarier than her flip",0.5,r/republicans,2024-08-09 11:40:01-04:00
the kamala harris boom-and-bust cycle - washington examiner,0.5,r/republicans,2024-08-09 11:35:16-04:00
hilary clinton reacts to ‘tampon tim’ meme after republicans mocked minnesota governor. tim walz for allowing tampons in boys toilets. “how nice of the trump camp to help publicize gov. tim walz's compassionate and common-sense policy of providing free menstrual products to students in minnesota.,0.53,r/republicans,2024-08-09 02:56:28-04:00
lefties losing it: tim walz caught in embarrassing lie,0.52,r/republicans,2024-08-08 22:57:36-04:00
all of tim walz's military service embellishments,0.44,r/republicans,2024-08-09 04:39:42-04:00
"is the family sugarcane plantation in jamaica owned by father and grandpa, the real reason kamala harris told us all she was indian and not black for over a decade?                                                                 ",0.54,r/republicans,2024-08-08 17:02:24-04:00
the dems will destroy free speech - tim walz promises,0.5,r/republicans,2024-08-08 21:53:21-04:00
vice president kamala harris' rally in detroit descends into 'complete chaos' - videos of event cast doubt about her leadership,0.53,r/republicans,2024-08-09 14:08:04-04:00
newly found video just rocked the kamala campaign!!! tim walz is done.,0.46,r/republicans,2024-08-09 20:16:58-04:00
lefties losing it: tim walz caught in embarrassing lie,0.58,r/republicans,2024-08-08 22:57:36-04:00
all of tim walz's military service embellishments,0.38,r/republicans,2024-08-09 04:39:42-04:00
the dems will destroy free speech - tim walz promises,0.44,r/republicans,2024-08-08 21:53:21-04:00
"report: trump calls harris a ""bitch""",0.98,r/politics,2024-08-10 09:35:25-04:00
"kamala harris winning over white voters from trump, polling suggests",0.95,r/politics,2024-08-10 04:06:01-04:00
"harris campaign rally draws massive crowd of 20,000 in arizona",0.93,r/politics,2024-08-09 22:20:07-04:00
harris leads trump in three key states times siena polls find,0.98,r/politics,2024-08-10 06:36:21-04:00
jesse ventura calls jd vance's criticism of walz military record ‘despicable’,0.98,r/politics,2024-08-10 02:44:23-04:00
"tim walz served his country honorably for 24 years. jd vance, trump need to respect that. he earned it",0.95,r/politics,2024-08-10 06:18:56-04:00
"harris' historically black sorority, alpha kappa alpha, files to form a pac",0.98,r/politics,2024-08-09 20:19:59-04:00
kamala harris could make history as the first president to work at mcdonald’s,0.95,r/politics,2024-08-09 19:14:31-04:00
democrats bask in optimism of harris surge: ‘enthusiasm is off the charts’,0.97,r/politics,2024-08-10 06:50:06-04:00
"harris calls for ceasefire, respect for protesters at arizona rally",0.97,r/politics,2024-08-09 21:47:23-04:00
donald trump isn't fun anymore: how kamala harris stole the show — and extinguished his flame,0.97,r/politics,2024-08-09 16:34:23-04:00
"george floyd's brother endorses harris-walz, says minnesota governor is 'built for this'",0.97,r/politics,2024-08-09 19:26:42-04:00
mesa mayor john giles encourages other republicans to abandon trump during harris rally,0.99,r/politics,2024-08-10 01:03:53-04:00
'our lives are on the line': why many lgbtq+ people hope for a harris win ,0.96,r/politics,2024-08-10 09:18:49-04:00
"how 'coach' tim walz led high schoolers with dad vibes, irrepressible energy, and one classic simpsons episode",0.98,r/politics,2024-08-10 09:31:08-04:00
"harris campaign launches gop outreach effort, led by former nc justice bob orr",0.98,r/politics,2024-08-10 09:17:23-04:00
"why environmental justice leaders see an ally in kamala harris | over 350 environmental justice advocates, policy makers and politicians endorsed harris last week, citing her “bold leadership” to fight climate change.",0.97,r/politics,2024-08-10 09:38:11-04:00
how jill stein’s v.p. pick could haunt kamala | green party nominee jill stein is expected to use her running mate to tap into the growing anger at democrats over their support for israel’s war on gaza.,0.09,r/politics,2024-08-10 10:35:27-04:00
will ‘swift boat’ attacks hurt tim walz? we asked a former john kerry strategist,0.23,r/politics,2024-08-10 10:15:22-04:00
jesse ventura endorses kamala harris for president of the united states of america,0.99,r/democrats,2024-08-10 00:55:35-04:00
today's arizona rally for harris/walz looks lit af 🔥🔥🔥🔥,0.99,r/democrats,2024-08-09 20:45:17-04:00
picture i took at the phoenix rally today. arizona is kamala country!!,0.99,r/democrats,2024-08-09 22:11:14-04:00
"harris leads trump in three key states, times/siena polls find",0.99,r/democrats,2024-08-10 09:31:29-04:00
kamala harris calls for ceasefire in gaza 🇵🇸,0.93,r/democrats,2024-08-10 09:08:32-04:00
"kamala harris and tim walz set a record the largest democratic rally in arizona tonight, packing a 20,000 seat arena in phoenix!!! ",0.99,r/democrats,2024-08-09 20:03:06-04:00
"harris campaign rally draws massive crowd of 20,000 in arizona",0.97,r/democrats,2024-08-10 09:02:17-04:00
it's okay for women to pick tim walz over the bear,0.98,r/democrats,2024-08-10 00:10:34-04:00
get ready now: republicans will refuse to certify a harris win,0.97,r/democrats,2024-08-09 17:51:24-04:00
tim walz is the best marksman in congress. but he doesn't need to be weird about it!,0.97,r/democrats,2024-08-09 08:18:02-04:00
"harris leads trump in three key states, times/siena polls find",0.78,r/moderatepolitics,2024-08-10 09:16:48-04:00
trump says he has agreed to offer from abc news to debate harris,0.93,r/moderatepolitics,2024-08-08 15:18:48-04:00
republicans start attacking walz by going after his military record,0.68,r/moderatepolitics,2024-08-07 22:01:55-04:00
i served with tim walz as a republican in the house. he'll be a good vice president,0.75,r/moderatepolitics,2024-08-07 12:28:13-04:00
tim walz repeatedly hosted muslim cleric who celebrated oct. 7 and shared pro-hitler website link,0.34,r/moderatepolitics,2024-08-09 21:08:11-04:00
"in a scenario where neither candidate gets to 270 electoral votes, and harris wins the contingent election in the house of representatives, if republicans controlled the senate, who would they choose for vice president?",0.57,r/PoliticalDiscussion,2024-08-09 22:10:54-04:00
is harris likely to become the next president and how close will it be compared to previous elections?,0.44,r/PoliticalDiscussion,2024-08-09 11:08:34-04:00
how are biden and “senior” members of congress reacting to kamala harris’ popularity (as it relates to the age difference)?,1.0,r/PoliticalDiscussion,2024-08-08 19:35:02-04:00
"in a scenario where neither candidate gets to 270 electoral votes, and harris wins the contingent election in the house of representatives, if republicans controlled the senate, who would they choose for vice president?",0.61,r/PoliticalDiscussion,2024-08-09 22:10:54-04:00
kamala harris takes eight-point lead over donald trump in new poll,0.89,r/politics,2024-08-08 06:45:54-04:00
tim walz's normal dad energy is causing maga to come unglued,0.96,r/politics,2024-08-08 06:56:12-04:00
republicans think trump is having a “nervous breakdown” over kamala harris,0.98,r/politics,2024-08-08 10:09:07-04:00
tim walz is giving maga a master class in manhood,0.96,r/politics,2024-08-08 08:39:12-04:00
weirdo j.d. vance desperately tries to claim tim walz is “weird”,0.97,r/politics,2024-08-08 09:32:44-04:00
"tim walz’s crack about j.d. vance’s couch hits right where republicans deserve it | cue the hand-wringing, which is a bit rich coming from this party.",0.98,r/politics,2024-08-08 07:18:39-04:00
harris-walz camouflage ‘midwest princess’ hat reaches nearly $1m in sales a day after release,0.98,r/politics,2024-08-08 10:45:44-04:00
donald trump attacks tim walz as 'very into the transgender',0.94,r/politics,2024-08-08 05:52:28-04:00
"'if you want donald trump to win, then say that': harris fires back at gaza protesters at rally",0.89,r/politics,2024-08-07 22:25:51-04:00
"harris takes 4-point lead over trump as favorability rating suddenly surges, poll finds",0.94,r/politics,2024-08-08 09:19:41-04:00
laura ingraham self-owns with botched attack on tim walz,0.97,r/politics,2024-08-08 06:57:26-04:00
harris shuts down trumpian ‘lock him up’ chants,0.92,r/politics,2024-08-07 18:50:33-04:00
j.d. vance awkwardly retreats after bizarre attempt to storm harris’ empty plane,0.96,r/politics,2024-08-07 18:42:45-04:00
kamala harris favorite to win election with bookmakers for first time,0.95,r/politics,2024-08-08 02:34:31-04:00
harris and walz seize on joyful message in contrast to darker trump themes,0.98,r/politics,2024-08-08 07:53:18-04:00
a harris presidency will give the gop time to purge trumpism,0.97,r/politics,2024-08-08 01:46:11-04:00
tim walz suddenly stops campaign rally after noticing someone needs help,0.88,r/politics,2024-08-07 16:01:54-04:00
tim walz’s net worth is less than the average american’s,0.97,r/politics,2024-08-08 11:47:32-04:00
tim walz is a first! a union member and not a lawyer,0.97,r/politics,2024-08-08 11:41:58-04:00
gop pollster frank luntz predicts kamala would win if election was held today ,0.97,r/politics,2024-08-08 11:51:05-04:00
"what it was like to be tim walz’s student in high school |
his former students say they’re excited for the rest of the world to experience the kindness and charm they got to see firsthand.",0.98,r/politics,2024-08-08 11:19:19-04:00
trump adviser stephen miller’s bizarre biden-harris ‘sex slavery’ meltdown,0.94,r/politics,2024-08-08 11:43:44-04:00
‘tampon tim’ walz is a weird meme behind a real problem,0.91,r/politics,2024-08-08 11:05:48-04:00
kamala harris aims her prosecutorial skills against the criminal trump,0.93,r/politics,2024-08-08 11:25:20-04:00
"an opposition researcher's reaction to tim walz's financial disclosure, which that showed he owned zero stocks: ""maybe personal finance isn’t one of his passions""",0.91,r/politics,2024-08-08 11:20:58-04:00
"'reagan' movie premiere invitees list includes biden, trump, harris and kennedy",0.22,r/politics,2024-08-08 11:34:52-04:00
could pete buttigieg be aiming for secretary of state if harris wins?,0.97,r/democrats,2024-08-07 22:51:39-04:00
"walz: “ trump never sat at that kitchen table like the one i grew up at, wondering how we were going to pay the bills, he sat in mar-a-lago wondering how he could cut taxes for his rich friends.” trump: “i was not always sitting at mar-a-lago, i was sitting at lots of other places.”",0.98,r/democrats,2024-08-07 16:21:32-04:00
trump left spinning by kamala harris’ surprise strength,0.98,r/democrats,2024-08-08 11:21:41-04:00
what about down ballot candidates? a kamala victory should be more than beating trump. it should be a path to getting things done.,0.99,r/democrats,2024-08-07 18:30:00-04:00
harris/walz huge lead in latest poll,0.99,r/democrats,2024-08-07 14:07:52-04:00
kamala takes 6 point lead among likely in new marquette poll.,0.77,r/moderatepolitics,2024-08-08 07:54:32-04:00
"trump holds 2-point lead over harris with a big advantage on economy, cnbc survey shows",0.7,r/moderatepolitics,2024-08-08 10:34:07-04:00
"in 60-year-old tim walz, kamala harris found a partner to advocate for reproductive rights",0.57,r/moderatepolitics,2024-08-08 12:02:17-04:00
republicans start attacking walz by going after his military record,0.67,r/moderatepolitics,2024-08-07 22:01:55-04:00
i served with tim walz as a republican in the house. he'll be a good vice president,0.74,r/moderatepolitics,2024-08-07 12:28:13-04:00
donald trump leads over kamala harris among jewish voters in new york state,0.33,r/moderatepolitics,2024-08-08 12:34:05-04:00
how tim walz—kamala harris’ running mate—lost the nra’s support on guns,0.6,r/moderatepolitics,2024-08-07 09:13:43-04:00
"from joe manchin to alexandria ocasio cortez, democrats quickly close ranks around tim walz",0.89,r/moderatepolitics,2024-08-06 21:28:24-04:00
"tim walz: can't wait to debate j.d. vance, ""if he's willing to get off the couch"" -- ""see what i did there?""",0.72,r/moderatepolitics,2024-08-06 21:49:25-04:00
"harris selects minnesota gov. tim walz as running mate, aiming to add midwest muscle to ticket",0.92,r/moderatepolitics,2024-08-06 09:05:07-04:00
why kamala harris chose tim walz,0.85,r/moderatepolitics,2024-08-06 12:48:21-04:00
per press reports harris has selected walz as her running mate. what role will he play in the campaign?,0.96,r/PoliticalDiscussion,2024-08-06 09:02:05-04:00
"can the harris campaign change the ""open borders"" narrative with recent border crossing data?",0.55,r/PoliticalDiscussion,2024-08-05 22:52:50-04:00
what impact do you think a hypothetical harris endorsement from mike pence would have on voters?,0.88,r/PoliticalDiscussion,2024-08-04 22:40:48-04:00
why did harris select waltz instead of shapiro for vp?,0.44,r/PoliticalDiscussion,2024-08-06 09:05:12-04:00
"can the harris campaign change the ""open borders"" narrative with recent border crossing data?",0.57,r/PoliticalDiscussion,2024-08-05 22:52:50-04:00
trump left spinning by kamala harris’ surprise strength,0.96,r/democrats,2024-08-08 11:21:41-04:00
a harris presidency will give the gop time to purge trumpism,0.98,r/politics,2024-08-08 01:46:11-04:00
tim walz’s net worth is less than the average american’s,0.96,r/politics,2024-08-08 11:47:32-04:00
4 reasons why labor unions love tim walz,0.95,r/politics,2024-08-08 11:02:48-04:00
kamala harris aims her prosecutorial skills against the criminal trump,0.94,r/politics,2024-08-08 11:25:20-04:00
"'reagan' movie premiere invitees list includes biden, trump, harris and kennedy",0.21,r/politics,2024-08-08 11:34:52-04:00
kamala harris storms ahead in polling,0.96,r/democrats,2024-08-08 10:15:05-04:00
vance jokes he's checking out his future vp plane while overlapping with harris at wisconsin airport,0.76,r/moderatepolitics,2024-08-08 10:14:31-04:00
why is tim walz facing accusations of stolen valor?,0.46,r/moderatepolitics,2024-08-07 16:18:39-04:00
trump left spinning by kamala harris’ surprise strength,0.97,r/democrats,2024-08-08 11:21:41-04:00
tim walz suddenly stops campaign rally after noticing someone needs help,0.9,r/politics,2024-08-07 16:01:54-04:00
harris shuts down trumpian ‘lock him up’ chants,0.97,r/politics,2024-08-07 18:50:33-04:00
j.d. vance awkwardly retreats after bizarre attempt to storm harris’ empty plane,0.98,r/politics,2024-08-07 18:42:45-04:00
j.d. vance’s ‘stolen valor’ claim against tim walz is total b.s.,0.97,r/politics,2024-08-07 14:36:22-04:00
newly leaked audio exposes how trump truly feels about kamala’s v.p.: even donald trump once had good things to say about minnesota governor tim walz.,0.99,r/politics,2024-08-07 17:50:27-04:00
"republicans are struggling to paint tim walz as a villain |
the gop is scrambling to find a line of attack against kamala harris's vp pick — and it's not going well",0.96,r/politics,2024-08-07 12:29:17-04:00
gov. tim walz doesn't own a single stock,0.92,r/politics,2024-08-07 11:10:44-04:00
"kamala harris overhauls donald trump, gains 23 points: poll",0.94,r/politics,2024-08-07 15:02:22-04:00
democrats raised $41 million after kamala harris picked tim walz to be her running mate,0.98,r/politics,2024-08-07 12:58:36-04:00
harris campaign plans to deploy tim walz as her anti-maga ‘sledgehammer’,0.96,r/politics,2024-08-07 10:19:21-04:00
harris' now polls better with white people than any democratic president since jimmy carter,0.98,r/politics,2024-08-07 21:05:49-04:00
tim walz is the perfect antidote to the brainwashed fox news dads,0.98,r/politics,2024-08-07 15:37:03-04:00
kamala harris campaign mocks donald trump on his own social media platform,0.98,r/politics,2024-08-07 16:53:53-04:00
"voters like tim walz a lot more than jd vance, new poll suggests",0.98,r/politics,2024-08-07 12:15:00-04:00
j.d. vance crashes and burns trying to defend his kamala conspiracy,0.98,r/politics,2024-08-07 15:25:36-04:00
trump’s meltdown during harris-walz rally sounds alarm: will family get him help or just ‘cash his checks?’,0.88,r/politics,2024-08-07 06:21:53-04:00
harris takes 3-point lead over trump as she gains on key issues: poll,0.96,r/politics,2024-08-07 09:07:45-04:00
"i served with tim walz as a republican in the house. he'll be a good vice president | more than ever, america needs a normal guy like tim walz to help lead our nation and bring us together",0.97,r/politics,2024-08-07 09:45:34-04:00
"'if you want donald trump to win, then say that': harris fires back at gaza protesters at rally",0.8,r/politics,2024-08-07 22:25:51-04:00
"tim walz, who spent decades as an enlisted soldier, brings years of work on vets issues to dem ticket",0.99,r/politics,2024-08-07 21:39:01-04:00
audio shows trump praised walz in 2020 for handling of riots after george floyd's death,0.97,r/politics,2024-08-07 22:26:16-04:00
minnesota court upholds walz-backed law restoring felons' right to vote,1.0,r/politics,2024-08-07 21:33:04-04:00
"walz: “ trump never sat at that kitchen table like the one i grew up at, wondering how we were going to pay the bills, he sat in mar-a-lago wondering how he could cut taxes for his rich friends.” trump: “i was not always sitting at mar-a-lago, i was sitting at lots of other places.”",0.99,r/democrats,2024-08-07 16:21:32-04:00
what about down ballot candidates? a kamala victory should be more than beating trump. it should be a path to getting things done.,1.0,r/democrats,2024-08-07 18:30:00-04:00
don't you think like walz might finally fix america's education problem?,0.97,r/democrats,2024-08-07 15:34:54-04:00
any of walz’s former student out there?,0.98,r/democrats,2024-08-07 10:49:37-04:00
